{
  "backgroundImage": [
    "/v1/media/00000000000000000000000001"
  ],
  "title": "Overskrift",
  "text": "Da dadadad dad aa da dadadad dad aa da dadadad dad aa da dadadad dad aa da dadadad dad aa da dadadad dad aadadadad dad aa da dadadad dad aa da dadadad dad aa da dadadad dad aa da dadadad dad aa da dadadad dad aa",
  "styling": {
    "fontPlacement": "bottom",
    "fontSize": "s"
  },
  "table": [
    {
      "type": "header",
      "columns": [
        {
          "title": "Column 1",
          "field": "column1"
        },
        {
          "title": "Column 2",
          "field": "column2"
        }
      ]
    },
    {
      "column1": "Data 1",
      "column2": "Data 2"
    },
    {
      "column1": "Data 3",
      "column2": "Data 4"
    }
  ]
}
